[
  {
    "id": 1,
    "slug": "humility",
    "Component Name": "Humility",
    "Associated Practices": [
      {
        "slug": "shared-ownership",
        "label": "Shared Ownership"
      },
      {
        "slug": "shared-leadership",
        "label": "Shared Leadership"
      }
    ],
    "Assessment Question": "I do not judge myself or others, I operate without dominance or arrogance",
    "Component Description": "Humility means treating yourself and everyone around you as equals, with no need to dominate or prove you are the smartest in the room. On a team it frees you to admit you do not have all the answers and to stay open to being wrong, which is exactly what lets a group share ownership and take turns leading. It is quiet, but it is the ground that Shared Ownership and Shared Leadership grow in.",
    "Associated Mindsets of the Component": "You believe your way is not the only right way, and that every person, no matter how new, has something to teach you. Being wrong is not a threat; it is a chance to learn.",
    "Associated Habits of the Component": "You hold back quick judgment, own your mistakes out loud, and give credit to others instead of taking it for yourself.",
    "Where Can I Learn More?": "Atlassian Team Playbook, practical plays for healthy teamwork: https://www.atlassian.com/team-playbook"
  },
  {
    "id": 2,
    "slug": "honesty-in-self",
    "Component Name": "Honesty In Self",
    "Associated Practices": [
      {
        "slug": "shared-ownership",
        "label": "Shared Ownership"
      },
      {
        "slug": "shared-leadership",
        "label": "Shared Leadership"
      }
    ],
    "Assessment Question": "I seek to discover ways I am lying to myself.",
    "Component Description": "Honesty in self is the inner work of catching the small ways we all fool ourselves, the hidden biases and the convenient excuses. It is not comfortable, but it keeps you self-aware and growing, and it is what makes you trustworthy enough to share ownership and help lead a team.",
    "Associated Mindsets of the Component": "You believe self-deception is a normal human habit worth catching, and that facing your blind spots honestly is what makes you better over time.",
    "Associated Habits of the Component": "You question your own assumptions, check your real motives, and reflect honestly on where you fell short instead of explaining it away.",
    "Where Can I Learn More?": "Atlassian Team Playbook, practical plays for healthy teamwork: https://www.atlassian.com/team-playbook"
  },
  {
    "id": 3,
    "slug": "honesty-towards-others",
    "Component Name": "Honesty Towards Others",
    "Associated Practices": [
      {
        "slug": "shared-leadership",
        "label": "Shared Leadership"
      }
    ],
    "Assessment Question": "I operate without deception or hiding.",
    "Component Description": "Honesty toward others means being straight with your teammates, without spin and without quietly sitting on the truth. It can feel risky in the moment, but it is what builds the trust a team leans on to make good decisions and share leadership.",
    "Associated Mindsets of the Component": "You believe people deserve the truth, and that hiding it, even to be nice, does more harm than good in the long run.",
    "Associated Habits of the Component": "You say what you really think, give feedback that is direct but kind, and do not withhold information the team needs.",
    "Where Can I Learn More?": "Atlassian Team Playbook, practical plays for healthy teamwork: https://www.atlassian.com/team-playbook"
  },
  {
    "id": 4,
    "slug": "acknowledgement",
    "Component Name": "Acknowledgement",
    "Associated Practices": [
      {
        "slug": "shared-ownership",
        "label": "Shared Ownership"
      },
      {
        "slug": "empowerment",
        "label": "Empowerment"
      },
      {
        "slug": "shared-leadership",
        "label": "Shared Leadership"
      }
    ],
    "Assessment Question": "I acknowledge the truth in others' words often, even when I think they could be wrong or have a different perspective",
    "Component Description": "Acknowledgement is recognizing the truth in what someone says, even when you do not fully agree. It shows people they were actually heard, which keeps conversations open and helps a team share ownership, empower each other, and lead together instead of talking past one another.",
    "Associated Mindsets of the Component": "You believe there is usually something valid in another person's view, even when it is incomplete.",
    "Associated Habits of the Component": "You name what is right in someone's point before you respond, rather than jumping straight to disagreement.",
    "Where Can I Learn More?": "Atlassian Team Playbook, practical plays for healthy teamwork: https://www.atlassian.com/team-playbook"
  },
  {
    "id": 5,
    "slug": "adaptability",
    "Component Name": "Adaptability",
    "Associated Practices": [
      {
        "slug": "agility",
        "label": "Agility"
      },
      {
        "slug": "collective-decision-making",
        "label": "Collective Decision Making"
      },
      {
        "slug": "continuous-improvement",
        "label": "Continuous Improvement"
      }
    ],
    "Assessment Question": "When events don't turn out how I expected, I am quick to adjust the path I am taking, and I encourage others to do so too",
    "Component Description": "Adaptability is changing course quickly when the situation shifts, and helping your teammates do the same. It is at the core of working in an agile way, where plans are expected to change as the team learns, and it feeds the practices of Agility, Collective Decision Making, and Continuous Improvement.",
    "Associated Mindsets of the Component": "You believe plans are really just guesses that should change as you learn, not promises set in stone.",
    "Associated Habits of the Component": "You adjust your approach as soon as new information arrives, and you help teammates let go of plans that no longer fit.",
    "Where Can I Learn More?": "The Agile Manifesto, the founding values of agile work: https://agilemanifesto.org/"
  },
  {
    "id": 6,
    "slug": "interactions-with-individuals",
    "Component Name": "Interactions with Individuals",
    "Associated Practices": [
      {
        "slug": "agility",
        "label": "Agility"
      }
    ],
    "Assessment Question": "I prioritize figuring out decisions with my teammates instead of developing perfect plans before I act.",
    "Component Description": "This is the agile habit of solving problems together with people rather than perfecting a plan alone up front. It comes straight from the Agile Manifesto value of individuals and interactions over processes and tools, and it is a building block of the Agility practice.",
    "Associated Mindsets of the Component": "You believe the best decisions come from working things out with people, not from planning in isolation.",
    "Associated Habits of the Component": "You bring questions to your teammates early and decide together instead of finishing a plan first and handing it over.",
    "Where Can I Learn More?": "The Agile Manifesto, the founding values of agile work: https://agilemanifesto.org/"
  },
  {
    "id": 7,
    "slug": "delivering-working-results",
    "Component Name": "Delivering Working Results",
    "Associated Practices": [
      {
        "slug": "agility",
        "label": "Agility"
      }
    ],
    "Assessment Question": "I prioritize getting the results into the hands of users and customers so that I can get feedback before I adjust.",
    "Component Description": "This is the agile focus on shipping something real and usable so you can learn from real feedback, rather than waiting for everything to be perfect. It reflects the Agile value of working software over comprehensive documentation, and it is one of the habits that make the Agility practice real.",
    "Associated Mindsets of the Component": "You believe honest feedback on something real beats endless planning every time.",
    "Associated Habits of the Component": "You get small, working results in front of users quickly and use what you learn to steer the next step.",
    "Where Can I Learn More?": "The Agile Manifesto, the founding values of agile work: https://agilemanifesto.org/"
  },
  {
    "id": 8,
    "slug": "customer-collaboration",
    "Component Name": "Customer Collaboration",
    "Associated Practices": [
      {
        "slug": "agility",
        "label": "Agility"
      }
    ],
    "Assessment Question": "I work with and talk to customers in order to determine the direction, rather than try to answer all questions up front.",
    "Component Description": "Customer collaboration means working shoulder to shoulder with customers to shape the direction, instead of trying to lock down every answer at the start. It comes from the Agile value of customer collaboration over contract negotiation, and it keeps the Agility practice pointed at what people really need.",
    "Associated Mindsets of the Component": "You believe the customer is a partner in figuring out what to build, not just someone you deliver to at the end.",
    "Associated Habits of the Component": "You talk with customers regularly and let what you hear steer the work as it unfolds.",
    "Where Can I Learn More?": "The Agile Manifesto, the founding values of agile work: https://agilemanifesto.org/"
  },
  {
    "id": 9,
    "slug": "inclusive-safety",
    "Component Name": "Inclusive Safety",
    "Associated Practices": [
      {
        "slug": "psychological-safety",
        "label": "Psychological Safety"
      }
    ],
    "Assessment Question": "I believe that everyone on the team, even the interns, have valuable perspective and decision-making abilities.",